Feed,Publish_DT,Title,Summary,Author,Link
World,2022-05-28 15:23:00,"Cardinal Angelo Sodano, Vatican Power Broker Linked With Sex Abuse Cover-Ups, Dies at 94","He rose to the second-highest-ranking position in the Roman Catholic Church, but his reputation was stained by his handling of sex-abuse cases.", ,https://www.nytimes.com/2022/05/28/obituaries/cardinal-angelo-sodano-dies.html
Business,2022-05-28 15:28:00,"Ron Rice, Creator of Hawaiian Tropic Lotion, Is Dead at 81","A poor, pale mountain boy who became smitten with the beach, he mixed some ingredients in a garbage can and found his place in the sun.", ,https://www.nytimes.com/2022/05/27/business/ron-rice-dead.html
Real Estate,2022-05-28 16:15:00,What Goes On Behind the Cameras at Home Makeover Shows?,Some homeowners said they were promised a dream house if a crew remade their homes for TV. The lawsuits they filed later told a different story., ,https://www.nytimes.com/2022/05/27/realestate/home-makeover-renovation-lawsuit.html
World,2022-05-28 16:30:00,Sounds of bombardment drown out the ‘last bell’ for the final day of school in Ukraine.,"On what is usually a day of festivities and fun, many of Ukraine’s students ended the academic year amid the sounds of war or from abroad.", ,https://www.nytimes.com/2022/05/28/world/europe/ukraine-war-last-day-of-school.html
World,2022-05-28 17:14:00,Australia Wields a New DNA Tool to Crack Missing-Person Mysteries,The technique can predict a person’s ancestry and physical traits without the need for a match with an existing sample in a database., ,https://www.nytimes.com/2022/05/28/world/australia/dna-phenotyping.html
Technology,2022-05-28 17:27:00,"How Influencers Hype Crypto, Without Disclosing Their Financial Ties","Logan Paul, Paul Pierce and other celebrities have promoted risky and obscure digital currencies, sometimes failing to mention their conflicts of interest.", ,https://www.nytimes.com/2022/05/27/technology/crypto-influencers.html
World,2022-05-28 17:52:00,An Irish National Treasure Gets Set for a Long-Needed Restoration,"The majestic Old Library at Trinity College Dublin, where some of Ireland’s most ancient and valuable books are stored, is a popular tourist attraction.", ,https://www.nytimes.com/2022/05/28/world/europe/dublin-trinity-library-restoration.html
Climate,2022-05-28 18:45:00,U.S. Forest Service Planned Burn Caused Largest New Mexico Wildfire,"The Calf Canyon and Hermits Peak fires, which merged, started as prescribed burns intended to prevent wildfires, federal officials said.", ,https://www.nytimes.com/2022/05/28/us/new-mexico-fire-planned-burn.html
Most Emailed,2022-05-28 18:59:00,The Internet Is Broken. How Do We Fix It?,The online system is broken. How do we fix it?, ,https://www.nytimes.com/2022/05/27/opinion/technology/what-would-an-egalitarian-internet-actually-look-like.html
Sports,2022-05-28 19:30:00,Medvedev Seizes Chance to Make an Impression on French Open Fans,"Daniil Medvedev and other Russians, barred from competing at Wimbledon because of the war in Ukraine, have made a run in the French Open. The ban remains a sensitive issue in tennis.", ,https://www.nytimes.com/2022/05/28/sports/tennis/french-open-medvedev-russians.html
Business,2022-05-28 19:31:00,Woman Gets 15 Months in Prison for Punching Flight Attendant in the Face,"Prosecutors said Vyvianna M. Quinonez, 29, of Sacramento, will also have to pay nearly $26,000 in restitution and a $7,500 fine for the May 2021 attack, which was widely viewed online.", ,https://www.nytimes.com/2022/05/28/us/flight-attendant-punched-sentencing.html
Business,2022-05-28 19:55:00,Gun in Texas Shooting Came From Company Known for Pushing Boundaries,"Daniel Defense, which makes military-style rifles, was an early adopter of direct-to-consumer marketing and has a history of running provocative ads.", ,https://www.nytimes.com/2022/05/28/business/daniel-defense-rifle-texas-shooting-gun.html
Sports,2022-05-28 20:40:00,Brittney Griner’s Supporters Have a New Strategy to Free Her: Make Noise,"Those close to Griner pursued a strategy of silence after her detention in Russia in February, hoping to avoid politicizing her case. Now they are amping up public pressure, with some of it aimed at President Biden.", ,https://www.nytimes.com/2022/05/28/sports/basketball/brittney-griner-russia.html
Business,2022-05-28 20:54:00,"Times Square at Its Overcrowded, Dizzying Worst Is Exactly What N.Y.C. Needs","The economic future of New York depends on everyone coming back, not just the tourists. Too bad office workers don’t want to join them.", ,https://www.nytimes.com/2022/05/28/business/times-square-new-york-pandemic.html
Science,2022-05-28 21:56:00,"Dinosaurs Started Out Hot, Then Some of Them Turned Cold","Scientists directly measured the metabolic rate of extinct animals, which revealed that some giant dinosaurs became coldblooded.", ,https://www.nytimes.com/2022/05/28/science/dinosars-warm-cold-blood.html
World,2022-05-29 03:32:00,Russians Crowdsource Supplies for Their Army in Ukraine,A grass-roots movement to get basic supplies to soldiers fighting in Ukraine reflects the growing recognition among Russians that their military was unprepared for major conflict., ,https://www.nytimes.com/2022/05/28/world/europe/russian-soldiers-military-supplies.html
Politics,2022-05-29 04:16:00,Massacres Test Whether Washington Can Move Beyond Paralysis on Gun Laws,The United States is facing a widening gap between the scale of gun violence and what America’s political leaders can agree are the right responses to the carnage., ,https://www.nytimes.com/2022/05/28/us/politics/gun-laws-senate-uvalde-buffalo.html
Technology,2022-05-29 07:00:00,They Did Their Own ‘Research.’ Now What?,"In spheres as disparate as medicine and cryptocurrencies, “do your own research,” or DYOR, can quickly shift from rallying cry to scold.", ,https://www.nytimes.com/2022/05/29/style/do-your-own-research.html
Sports,2022-05-29 08:41:00,Why the Champions League Final Was Delayed,European soccer’s showcase game kicked off more than 30 minutes late after overcrowding at the stadium gates led to clashes between fans and the police., ,https://www.nytimes.com/2022/05/28/sports/soccer/ucl-final-fake-tickets-delay.html
World,2022-05-29 08:47:00,Here are the latest developments in the war in Ukraine.,, ,https://www.nytimes.com/2022/05/29/world/here-are-the-latest-developments-in-the-war-in-ukraine.html
USA,2022-05-29 09:00:00,Democratic States Push Gun Control Bills with Congress Gridlocked,Democratic state leaders from California to New Jersey are demanding immediate action after the Uvalde shooting., ,https://www.nytimes.com/2022/05/29/us/states-gun-restrictions.html
Technology,2022-05-29 09:00:00,Inside the Apple Store Battle for Union Representation,"Weary from the pandemic and pressured by inflation, retail employees of the tech giant are holding votes on whether to unionize.", ,https://www.nytimes.com/2022/05/29/technology/apple-store-union.html
Real Estate,2022-05-29 09:00:00,"Homes That Sold for Around $600,000",Recent residential sales in New York City and the region., ,https://www.nytimes.com/2022/05/29/realestate/homes-that-sold-for-around-650000.html
Sports,2022-05-29 09:00:00,"Even in Flush Tennis, Equal Pay is a Struggle",The top players make tens of millions. Others have trouble breaking even., ,https://www.nytimes.com/2022/05/29/sports/tennis/women-tennis-equal-pay.html
Business,2022-05-29 11:00:00,The Week in Business: Escalating U.S. Sanctions on Russia,"The chip maker Broadcom continued its acquisitive streak, buying VMware. Gas prices head higher. And a report will show if job growth continues to be strong.", ,https://www.nytimes.com/2022/05/29/business/the-week-in-business-sanctions-russia.html
World,2022-05-29 11:33:00,A Shattered Town,Families and loved ones are leaning on each other to cope with the Texas school shooting., ,https://www.nytimes.com/2022/05/29/briefing/uvalde-shooting-families-grieving.html
Science,2022-05-29 13:21:00,Russian Academics Aim to Punish Colleagues Who Backed Ukraine Invasion,A campaign is circulating a list of dozens of researchers in the hopes they will be denied the prestige of election into the Russian Academy of Sciences., ,https://www.nytimes.com/2022/05/27/science/russia-ukraine-science-academy.html
Science,2022-05-29 13:55:00,A Balm for Psyches Scarred by War,"MDMA-assisted treatment for post-traumatic stress disorder “represents real hope for long-term healing,” health experts say.", ,https://www.nytimes.com/2022/05/29/health/mdma-therapy-ptsd.html
World,2022-05-29 14:20:00,"Plane Crashes in Nepal With 22 Aboard, Government Says",The search for the plane and its passengers and crew was being hampered by bad weather., ,https://www.nytimes.com/2022/05/29/world/asia/nepal-plane-crash.html
World,2022-05-29 14:32:00,"In Latin America, leftist leaders are on the rise amid widespread economic suffering.",, ,https://www.nytimes.com/2022/05/29/world/americas/in-latin-america-leftist-leaders-are-on-the-rise-amid-widespread-economic-suffering.html
World,2022-05-29 15:17:00,Lavish Projects and Meager Lives: The Two Faces of a Ruined Sri Lanka,A frenzy of building on borrowed money in the Rajapaksa family’s home district illustrates the hubris and mismanagement that led the country into economic collapse., ,https://www.nytimes.com/2022/05/29/world/asia/sri-lanka-rajapaska-hambantota.html
World,2022-05-29 16:28:00,U.N. Human Rights Chief Tempers Criticism at End of China Trip,Rights groups and overseas Uyghurs had called for vociferous condemnation of China’s policies toward minorities in the country’s far West. They were highly disappointed., ,https://www.nytimes.com/2022/05/28/world/asia/un-human-rights-china.html
Sports,2022-05-29 16:30:00,Dave Stewart Hopes to Bring MLB Team to Nashville,"Dave Stewart was a star player, an executive and an agent. He believes his sport’s path forward is Black ownership — and he is trying his best to make that happen in Nashville.", ,https://www.nytimes.com/2022/05/29/sports/baseball/dave-stewart-nashville.html
Business,2022-05-29 17:08:00,Can Paramount Compete With Netflix and Disney?,"The dominance of Netflix and Disney in streaming has forced many companies to join forces. So far, Paramount has gone its own way.", ,https://www.nytimes.com/2022/05/29/business/media/paramount-streaming.html
World,2022-05-29 17:50:00,Pope Francis Announces 21 New Cardinals,"The new “princes of the church” hail from places like India, Nigeria, Singapore and South Korea. They will be among those who help choose a new pope.", ,https://www.nytimes.com/2022/05/29/world/europe/pope-francis-21-new-cardinals.html
World,2022-05-29 18:44:00,"As Boris Johnson Stumbles, Labour Struggles to Offer a Clear Message","Out of power for 12 years, Britain’s Labour Party has made some gains, but its message hasn’t won back the rust belt regions that abandoned it in the last election.", ,https://www.nytimes.com/2022/05/29/world/europe/labour-struggles-rust-belt-britain.html
Climate,2022-05-29 19:00:00,The Rise and Fall of America’s Environmentalist Underground,"This year, one of the last fugitives of the Earth Liberation Front pleaded guilty to arson — at a moment when climate activists are again flirting with radical ideas.", ,https://www.nytimes.com/2022/05/26/magazine/earth-liberation-front-joseph-mahmoud-dibee.html
Most Emailed,2022-05-29 19:00:00,Gun Safety Must Be Everything That Republicans Fear,"Republicans worry that gun safety laws could lead to national gun registries, insurance requirements and bans. I hope they do.", ,https://www.nytimes.com/2022/05/29/opinion/gun-safety-republicans.html
World,2022-05-29 19:05:00,"Who is Federico Gutiérrez, a right-wing candidate for the president of Colombia?",, ,https://www.nytimes.com/2022/05/29/world/americas/who-is-federico-gutierrez-candidate.html
Business,2022-05-29 19:06:00,‘Top Gun: Maverick’ Lands Triumphantly on Opening Weekend,The film industry takes the estimated $151 million in North American ticket sales as a breakthrough after a long pandemic slump., ,https://www.nytimes.com/2022/05/29/movies/top-gun-maverick-box-office.html
Politics,2022-05-29 19:15:00,‘2000 Mules’ Repackages Trump’s Election Lies,"A new documentary from Trump allies makes the latest case the election was stolen, but the group behind the claim has been assailed even by some on the hard right.", ,https://www.nytimes.com/2022/05/29/us/politics/2000-mules-trump-conspiracy-theory.html
Business,2022-05-29 19:49:00,The Texas Law That Has Banks Saying They Don’t ‘Discriminate’ Against Guns,Recent legislation requires firms to declare that they don’t “discriminate” against the firearm industry — or risk losing lucrative business with the state., ,https://www.nytimes.com/2022/05/28/business/dealbook/texas-banks-gun-law.html
Business,2022-05-29 20:04:00,"At Taco Bell, the Drag Brunch Goes Corporate","The glittery live shows have long been a staple in many cities, but the fast-food chain is taking that a step further.", ,https://www.nytimes.com/2022/05/27/dining/taco-bell-drag-brunch.html
Politics,2022-05-29 20:16:00,"E. Robert Wallach, 88, Lawyer Linked to Reagan-Era Scandal, Dies","Convicted in a fraud case that took down an attorney general, he successfully appealed, and later defended himself in a retrial.", ,https://www.nytimes.com/2022/05/29/us/politics/e-robert-wallach-dead.html
World,2022-05-29 20:58:00,Your Monday Briefing: A ‘Toothless’ Trip to Xinjiang,The U.N.’s top human rights official cozied up to Beijing on a trip to China., ,https://www.nytimes.com/2022/05/29/briefing/china-un-bachelet-xinjiang-asia.html
Most Emailed,2022-05-29 21:02:00,Help! The Airline Changed My Flight Itinerary (for the Worse),Airlines are within their contractual rights to cancel booked flights and place passengers on less-convenient routes with hours-long layovers. Our columnist investigates whether travelers have any recourse., ,https://www.nytimes.com/2022/05/24/travel/airline-flight-itinerary.html
Most Shared,2022-05-29 21:02:00,F.B.I. Investigates Basquiat Paintings Shown at Orlando Museum of Art,A subpoena raises questions about an exhibition of works “purported to be by artist Jean-Michel Basquiat.”, ,https://www.nytimes.com/2022/05/29/arts/design/fbi-basquiat-paintings-orlando-museum.html
USA,2022-05-29 22:34:00,Justice Department Will Review Law Enforcement Response to Uvalde Shooting,"The review, which came at the request of Uvalde’s mayor, comes amid criticism from parents and community leaders over how long it took police to intervene and stop the gunman.", ,https://www.nytimes.com/2022/05/29/us/critical-review-texas-shooting-justice-department.html
Sports,2022-05-29 22:41:00,Marcus Ericsson Wins the Indy 500 After a Late Red Flag,"With a few laps to go, Marcus Ericsson seemed to have the race well in hand. But a crash and a restart made him work a little harder for the victory.", ,https://www.nytimes.com/2022/05/29/sports/autoracing/marcus-ericsson-wins-indianapolis-500.html
Sports,2022-05-29 22:42:00,Leylah Fernandez and Coco Gauff Advance at the French Open,"She outlasted Amanda Anisimova, a hard-hitting American, showing the kind of big-stage composure that got her to the final of last year’s U.S. Open.", ,https://www.nytimes.com/2022/05/29/sports/tennis/fernandez-gauff-stephens-french-open.html
USA,2022-05-29 23:12:00,"5 Dead in Boat Collision in Georgia, Officials Say","Four other people were hospitalized. One of them was charged with driving a boat while under the influence, the authorities said.", ,https://www.nytimes.com/2022/05/29/us/georgia-boat-crash-deaths.html
World,2022-05-30 01:39:00,"In Colombia, a Leftist and a Right-Wing Populist Head for June Runoff",The results in the first round of voting delivered a stunning blow to Colombia’s dominant conservative political class., ,https://www.nytimes.com/2022/05/29/world/americas/colombia-election-results.html
World,2022-05-30 01:52:00,Indian Couple Sue Their Son for Not Giving Them a Grandchild,"A couple in India are demanding that their son and daughter-in-law have a child or pay them $650,000 in damages. “This is an Indian parent thing,” their lawyer said.", ,https://www.nytimes.com/2022/05/29/world/asia/india-couple-grandchild-suing.html
Business,2022-05-30 01:53:00,Global Brands Seek Clarity on Xinjiang,"Companies that sourced cotton from the region in China are weighing evidence of forced labor, a lack of visibility into operations and new regulation.", ,https://www.nytimes.com/2022/05/27/business/cotton-xinjiang-forced-labor-retailers.html
World,2022-05-30 02:06:00,Ukraine Launches Counteroffensive on Russans in Kherson,"“Hold on, Kherson, we’re coming!” the Ukrainian military declared as it pushed to retake territory in a key southern city.", ,https://www.nytimes.com/2022/05/29/world/europe/ukraine-russia-war-kherson.html
Most Viewed,2022-05-30 02:27:00,"Ray Liotta, of ‘Goodfellas’ and ‘Field of Dreams,’ Dies at 67","He was known for his intensity, especially in crime dramas, but he was also adept at comedy. “You want to do as many different genres as you can,” he once said.", ,https://www.nytimes.com/2022/05/26/movies/ray-liotta-dead.html
World,2022-05-30 02:58:00,Afghanistan Tries to Stamp Out Opium Again,"The multibillion-dollar trade has survived previous bans. Now, the Taliban are going after solar-powered water pumps to try to dry up poppy crops in the middle of a national economic crisis.", ,https://www.nytimes.com/2022/05/29/world/asia/afghanistan-opium-taliban.html
World,2022-05-30 03:01:00,Russia War Dead Tended by Ukrainian Soldiers,"Ukrainians hope that if they safeguard Russia’s war dead, they will be more likely to get back their own.", ,https://www.nytimes.com/2022/05/29/world/russian-casualties-ukraine.html
World,2022-05-30 05:02:00,Here are the latest developments in the war in Ukraine.,, ,https://www.nytimes.com/2022/05/30/world/europe/here-are-the-latest-developments-in-the-war-in-ukraine.html
World,2022-05-30 05:06:00,Your Monday Briefing,A new front in Russia’s war in Ukraine., ,https://www.nytimes.com/2022/05/30/briefing/uvalde-biden-ukraine-south.html
Sports,2022-05-30 06:19:00,Boston Celtics Beat Miami Heat in Game 7 for Trip to N.B.A. Finals,"The Celtics led by 15 after the first quarter. Miami’s Jimmy Butler fueled the Heat’s comeback attempt, but it wasn’t enough.", ,https://www.nytimes.com/2022/05/29/sports/boston-celtics-miami-heat-game-7-nba-finals.html
World,2022-05-30 06:28:00,"For Russian-Speaking Ukrainians, Language Clubs Offer Way to Defy Invaders",Many Ukraine citizens speak Russian as their first language. Volunteer organizations are helping them improve their Ukrainian and abandon “the occupiers’ language.”, ,https://www.nytimes.com/2022/05/29/world/europe/ukraine-russia-language.html
USA,2022-05-30 07:00:00,The Men Lost to 20 Bruckner Boulevard,They were transforming a century-old Bronx ice house into a charter school. It became one of the deadliest construction sites in New York City in almost two decades., ,https://www.nytimes.com/2022/05/30/us/nyc-construction-deaths-immigrants.html
Politics,2022-05-30 07:00:00,"Gov. Hochul Stockpiles Donations, as Rivals Struggle to Keep Pace","Real estate, unions and crypto interests were among the donors to Ms. Hochul. Here are five takeaways from the money battle in New York’s race for governor.", ,https://www.nytimes.com/2022/05/30/nyregion/gov-hochul-leads-rivals-donations.html
USA,2022-05-30 07:00:00,How a Church Became a Hub for Uvalde’s Grief,"As soon as the scale of the tragedy became clear, congregants rushed to Sacred Heart Catholic Church. In the days since, they’ve kept coming in search of comfort and community.", ,https://www.nytimes.com/2022/05/30/us/uvalde-church-sacred-heart.html
Politics,2022-05-30 07:00:00,"From Sandy Hook to Uvalde, the Violent Images Never Seen","Frustrated Americans ask whether the release of graphic photos of gun violence would lead to better policy. But which photos, and who decides?", ,https://www.nytimes.com/2022/05/30/us/politics/photos-uvalde.html
Politics,2022-05-30 08:51:00,"For NATO, Turkey Is a Disruptive Ally","President Recep Tayyip Erdogan’s block on NATO membership for Sweden and Finland is likely to be managed, but Washington and the rest of the alliance are annoyed.", ,https://www.nytimes.com/2022/05/30/us/politics/turkey-nato-russia.html
Climate,2022-05-30 09:00:00,How the ‘Queen of Slag’ Is Transforming Industrial Sites,The landscape architect Julie Bargmann focuses on contaminated and forgotten urban sites. The results are both beautiful and socially conscious., ,https://www.nytimes.com/2022/05/30/arts/design/julie-bargmann-landscape-architecture-industrial-urban.html
Business,2022-05-30 09:00:00,"Hit Hard by High Energy Costs, Hawaii Looks to the Sun","The state is seeking to replace coal and oil with solar energy, aiming to rely extensively on rooftop panels on single-family homes.", ,https://www.nytimes.com/2022/05/30/business/hawaii-solar-energy.html
World,2022-05-30 09:00:00,Circling Sicily on Its Regional Trains,"A Dutch photographer, documenting the culture of regional train travel, managed to get around the Italian island for less than $100. Here’s what she saw.", ,https://www.nytimes.com/2022/05/30/travel/sicily-regional-trains.html
Real Estate,2022-05-30 09:00:00,Shopping for Watering Cans,"The best watering cans are not only useful, but nice to look at, too. The real challenge may be choosing just one.", ,https://www.nytimes.com/2022/05/30/realestate/shopping-watering-cans.html
World,2022-05-30 09:05:00,"Holiday weekend in the U.S. resembles prepandemic times, as experts and the White House remain wary of virus risk.","While there is a rise in confirmed daily coronavirus cases and hospitalizations, Memorial Day observations are not being scrapped.", ,https://www.nytimes.com/2022/05/30/world/holiday-weekend-in-the-us-resembles-prepandemic-times-as-experts-and-the-white-house-remain-wary-of-virus-risk.html
World,2022-05-30 10:27:00,The Start of Summer,We’ve got some recommendations., ,https://www.nytimes.com/2022/05/30/briefing/memorial-day-summer-guide-books-travel-sports.html
Most Emailed,2022-05-30 11:36:00,America’s Teachers Offer Answers to the Education Crisis,“Our system had fault lines way before the pandemic.”, ,https://www.nytimes.com/2022/05/29/opinion/pandemic-teachers-advice.html
Most Shared,2022-05-30 11:42:00,"After Uvalde, We Must Ask: Is Active Shooter Training Working?",Why did the police leadership make that call?, ,https://www.nytimes.com/2022/05/30/opinion/uvalde-school-shooting.html
World,2022-05-30 12:30:00,Explosion Hits Russian-Occupied Melitopol,"Pro-Kremlin authorities in the city blamed Ukrainian partisans for the blast, which they said had injured two people.", ,https://www.nytimes.com/2022/05/30/world/europe/melitopol-explosion.html
Sports,2022-05-30 12:35:00,"It’s Djokovic vs. Nadal, the French Open Rematch We’ve Been Waiting For","Djokovic, the world No. 1, and Nadal, the 13-time French Open champion, will continue their epic rivalry on Tuesday in the quarterfinal at Roland Garros.", ,https://www.nytimes.com/2022/05/29/sports/tennis/djokovic-nadal-french-open.html
Business,2022-05-30 12:59:00,How Some People Travel to the U.S. After Positive Covid Tests,"Entering the United States by air requires a negative coronavirus test. Some people who can’t provide one are using a workaround: flying to Canada or Mexico, then entering via a land border.", ,https://www.nytimes.com/2022/05/28/travel/us-travel-covid-test.html
Real Estate,2022-05-30 13:00:00,What $2.2 Million Buys You in California,"A two-bedroom condominium unit in Santa Barbara, a 1937 Art Deco house in San Francisco and a 1994 retreat in San Juan Capistrano.", ,https://www.nytimes.com/2022/05/30/realestate/home-prices-california.html
Politics,2022-05-30 13:58:00,Pelosi’s Husband Faces Drunken Driving Charge in California,"House Speaker Nancy Pelosi was not with her husband, Paul, when he was arrested in Napa County on Saturday, a spokesman said.", ,https://www.nytimes.com/2022/05/29/us/politics/nancy-pelosi-husband-paul-arrested.html
World,2022-05-30 14:16:00,"As Ukraine Fights, Does the E.U. Owe It Membership?","Brussels supports Kyiv’s battle against Russia, but gaining full membership to the bloc could take years. Is there another way to bind Ukraine, Moldova and Georgia to Europe?", ,https://www.nytimes.com/2022/05/30/world/europe/eu-summit-ukraine-enlargement-accession-talks-nato.html
Business,2022-05-30 14:48:00,These Veterans Started Businesses Inspired by Their Deployments,"Some veterans have started businesses that draw from their experiences in Iraq and Afghanistan, and thrived.", ,https://www.nytimes.com/2022/05/30/us/politics/veterans-small-business.html
World,2022-05-30 14:57:00,A Cafe in Philippines is Devoted to Duterte’s Drug War Victims,"Served along with the lattes are personal stories from the staff, who are relatives of those who died in some of the thousands of extrajudicial killings in the Philippines.", ,https://www.nytimes.com/2022/05/29/world/asia/philippines-duterte-victims.html
World,2022-05-30 15:08:00,A Russian Plane Crashed Into a House. Death Was Parceled Out Randomly.,"Some fortuitous timing in doing chores saved a family that lived in the Ukrainian city of Chernihiv. A few blocks away, things turned out very differently.", ,https://www.nytimes.com/2022/05/30/world/europe/ukraine-russia-chernihiv.html
Business,2022-05-30 15:22:00,"Colin Forbes, a ‘Designer’s Designer,’ Is Dead at 94","He was best known as the brain behind Pentagram, the influential partnership that has been a force in the design world for half a century.", ,https://www.nytimes.com/2022/05/26/arts/design/colin-forbes-dead.html
