Feed,Publish_DT,Title,Summary,Author,Link
Economy,2022-05-25 20:29:00,"E. Gerald Corrigan, Who Helped Ease ’87 Stock Crash, Dies at 80","As president of the Federal Reserve Bank of New York, he favored flooding the financial system with cash to restore confidence among investors.", ,https://www.nytimes.com/2022/05/25/business/e-gerald-corrigan-dead.html
Most Viewed,2022-05-25 20:35:00,‘How to Murder Your Husband’ Writer Convicted of Murdering Husband,"Nancy Brophy, a 71-year-old romance novelist, was accused in the shooting death of her husband. She said prosecutors had sketched a flawed plotline.", ,https://www.nytimes.com/2022/05/25/us/novelist-nancy-brophy-murder-husband.html
Technology,2022-05-25 23:16:00,"Twitter Fined in Privacy Settlement, as Musk Commits More Equity for Deal","Twitter did not do enough to tell its users that the personal data it had collected was used partly to help marketers target ads, the F.T.C. and Justice Department said.", ,https://www.nytimes.com/2022/05/25/technology/twitter-fined-ftc-doj-privacy.html
Most Viewed,2022-05-25 23:17:00,Kate Moss Testifies That Johnny Depp Did Not Push Her Down Stairs,"Appearing as a witness for Mr. Depp, whom she dated in the 1990s, the British model countered testimony by the actor’s ex-wife, Amber Heard, who had alluded to a rumored incident between them.", ,https://www.nytimes.com/2022/05/25/arts/kate-moss-johnny-depp-trial.html
Most Viewed,2022-05-26 01:56:00,Trump Said to Have Reacted Approvingly to Jan. 6 Chants About Hanging Pence,The House committee investigating the Capitol assault has heard accounts of the former president’s remarks as he watched the riot unfold on television., ,https://www.nytimes.com/2022/05/25/us/politics/trump-pence-jan-6.html
Science,2022-05-26 02:02:00,Live Video: Boeing’s Starliner Lands on Earth,The largely successful journey of the capsule could set up a flight for NASA with astronauts aboard before the year’s end., ,https://www.nytimes.com/2022/05/25/science/boeing-starliner-landing-nasa.html
Climate,2022-05-26 03:54:00,E.P.A. to Block Pebble Mine Project in Alaska,"The E.P.A. has proposed to ban the disposal of mining waste in the Bristol Bay watershed, a decision that very likely means the end of the Pebble Mine project.", ,https://www.nytimes.com/2022/05/25/climate/pebble-mine-alaska-epa.html
Business,2022-05-26 09:00:00,South Korean Workers Turn the Tables on Their Bad Bosses,"“South Koreans live with an enormous tolerance for abuse” from the powerful, said one famously bullied advocate. A backlash has erupted.", ,https://www.nytimes.com/2022/05/26/business/south-korea-bullying-gapjil.html
Real Estate,2022-05-26 09:00:00,Gen Zers Are Buying Homes. Here’s Where They’re Looking.,"Priced out of large metro areas, many young adults are seeking mortgages in midsize cities, new research shows.", ,https://www.nytimes.com/2022/05/26/realestate/generation-z-home-buying.html
Business,2022-05-26 10:00:00,"Are Defenders the New Monteros? If So, What’s Next?","Buyers have been turning to cheaper substitutes and finding, to their surprise, that some are the equal of the more established collectible.", ,https://www.nytimes.com/2022/05/26/business/vintage-cars-montero-defender.html
Climate,2022-05-26 12:57:00,Jimmy Carter Steps Into Fight Over  Proposed Road in Alaska,The legal battle over the gravel route could gut an environmental law that the 39th president called one of his highest achievements., ,https://www.nytimes.com/2022/05/25/climate/alaska-anilca-wilderness-area.html
Real Estate,2022-05-26 13:00:00,Homes for Sale in Connecticut and Westchester,"This week’s available properties are a four-bedroom house in New Canaan, Conn., and a six-bedroom in Rye, N.Y.", ,https://www.nytimes.com/2022/05/26/realestate/housing-market-near-nyc.html
Real Estate,2022-05-26 13:00:00,Homes for Sale in New York City,"This week’s available properties are in Carnegie Hill, Clinton Hill and in the East Village.", ,https://www.nytimes.com/2022/05/26/realestate/housing-market-nyc.html
Science,2022-05-26 13:51:00,F.D.A. Chief Details ‘Shocking’ Conditions at Baby Formula Plant,"Agency inspectors found a leaking roof, standing water and cracked production equipment before a facility shutdown that led to major shortages.", ,https://www.nytimes.com/2022/05/25/health/fda-baby-formula-shortage.html
Homepage USA,2022-05-26 14:28:00,The Root of Haiti’s Misery: Reparations to Enslavers,"In 1791, enslaved Haitians ousted the French and founded a nation. But France made generations of Haitians pay for their freedom. How much it cost them was a mystery, until now.", ,https://www.nytimes.com/2022/05/20/world/americas/haiti-history-colonized-france.html
Climate,2022-05-26 14:43:00,Interested in Solar Panels? Here Is Some Advice.,Buying a solar energy system can be expensive and confusing. Here are some things to think about if you are in the market for solar panels., ,https://www.nytimes.com/2022/05/24/business/energy-environment/solar-panel-advice.html
Business,2022-05-26 14:59:00,Where the Ice Cream Cones at Dairy Queen and Mister Softee Come From,"Joy Baking Group has cornered much of the market with one guiding principle: When it comes to cones, people want what they know.", ,https://www.nytimes.com/2022/05/26/dining/joy-ice-cream-cones.html
Homepage USA,2022-05-26 15:27:00,Margo Jefferson Discusses Ella Fitzerald and Childhood Icons,"When you’re young, the pop culture you absorb becomes a kind of “parent.” Wesley Morris and the critic Margo Jefferson reflect on the icons who shaped them.", ,https://www.nytimes.com/2022/05/26/podcasts/still-processing-ella-fitzgerald-margo-jefferson.html
Science,2022-05-26 16:46:00,Imaging Contrast Dye Shortage Delays Tests for Diseases,Many U.S. hospitals are postponing scans used to diagnose diseases after a Covid lockdown in China hobbled the main U.S. supplier of an imaging chemical., ,https://www.nytimes.com/2022/05/26/health/dye-contrast-scan-shortage.html
Climate,2022-05-26 17:01:00,A Pompeii Man’s DNA Rises From the Ancient Ashes of Vesuvius,Genetic material recovered from a 1st-century Pompeii man reveals a spinal disorder and ancestral links to Anatolia., ,https://www.nytimes.com/2022/05/26/science/pompeii-vesuvius-dna-archaeology.html
Business,2022-05-26 18:02:00,Bus Maker Settles Fraud Case Tied to Government Contract,"The company, New Flyer, a supplier to Los Angeles County, was accused of not fulfilling a commitment to create jobs that paid agreed-upon wages and benefits.", ,https://www.nytimes.com/2022/05/26/business/new-flyer-ca-fraud.html
Business,2022-05-26 18:17:00,Russia Cuts Rates as Ruble Hits Multiyear High,The Russian central bank is seeking to support an economy hurt by inflation and sanctions., ,https://www.nytimes.com/2022/05/26/business/russia-rates-ruble.html
Business,2022-05-26 18:24:00,Icahn’s Loses Clash With McDonald’s Over Pig Welfare,The activist investor had nominated two directors to the company’s board as part of an animal welfare campaign., ,https://www.nytimes.com/2022/05/26/business/carl-icahn-mcdonalds-pigs.html
Climate,2022-05-26 18:25:00,Supreme Court Allows Greenhouse Gas Cost Estimates,Louisiana and other Republican-led states challenged a federal working group’s efforts to develop standards for agencies to use in quantifying the harms caused by emissions., ,https://www.nytimes.com/2022/05/26/us/politics/supreme-court-greenhouse-gas-emissions.html
Most Emailed,2022-05-26 18:39:00,Memorial Day BBQ Side Dishes Your Guests Will Love,"Wow your friends and family with slaws, salads and braises that don’t shy away from big flavor.", ,https://www.nytimes.com/article/best-barbecue-side-dishes.html
Technology,2022-05-26 19:24:00,Debunking 3 Viral Rumors About the Texas Shooting,False and unfounded claims started to spread online shortly after the killings., ,https://www.nytimes.com/2022/05/25/technology/texas-shooting-misinformation.html
Business,2022-05-26 19:43:00,U.K. Announces Windfall Tax on Oil and Gas Profits,The tax on the “extraordinary” profits of oil and gas companies is expected to raise 5 billion pounds and help fund £15 billion in payments to households., ,https://www.nytimes.com/2022/05/26/business/uk-oil-company-profits-tax.html
Business,2022-05-26 19:46:00,White House Aims to Increase Regulation and Competition in Poultry Industry,More than 90 percent of chickens eaten by Americans are raised by farmers under contracts with poultry processing companies., ,https://www.nytimes.com/2022/05/26/business/biden-poultry-processors-growers.html
Business,2022-05-26 20:11:00,Former Head of Louvre Is Charged in Artifact Trafficking Case,"Jean-Luc Martinez, who led the museum from 2013 to 2021, was charged with complicity in fraud and money laundering in an investigation into the trafficking of Egyptian antiquities.", ,https://www.nytimes.com/2022/05/26/arts/design/louvre-jean-luc-martinez-trafficking.html
Science,2022-05-26 20:41:00,Meet the Salamanders That Can Glide Wherever They Need to Go,With the greatest of ease it twists and turns from the tops of redwood trees., ,https://www.nytimes.com/2022/05/26/science/salamanders-gliding-redwoods.html
Most Viewed,2022-05-26 20:54:00,The Husband of a Teacher Killed in Texas School Shooting Has Died,"The couple had been married for 24 years and had four children, with the oldest 23 and the others teenagers.", ,https://www.nytimes.com/2022/05/26/us/irma-garcia-husband-death-uvalde.html
Technology,2022-05-26 20:54:00,Broadcom to Acquire VMware in $61 Billion Enterprise Computing Deal,The resulting combination of chip company and software maker would be one of the most important suppliers of technology to the cloud computing market., ,https://www.nytimes.com/2022/05/26/technology/broadcom-vmware-deal.html
Technology,2022-05-26 22:35:00,A Face Search Engine Anyone Can Use Is Alarmingly Accurate,"PimEyes is a paid service that finds photos of a person from across the internet, including some the person may not want exposed. “We’re just a tool provider,” its owner said.", ,https://www.nytimes.com/2022/05/26/technology/pimeyes-facial-recognition-search.html
Politics,2022-05-26 23:28:00,Justice Dept. Won’t Prosecute Ex-F.B.I. Agents Accused of Mishandling Nassar Case,"The decision ends a review the department initiated in October, months after its inspector general issued a scathing report that sharply criticized the F.B.I.’s handling of the case.", ,https://www.nytimes.com/2022/05/26/us/politics/justice-dept-fbi-nassar.html
Business,2022-05-27 03:20:00,"Macy’s, Dollar General and Dollar Tree Shares Soar After Earnings Reports","Macy’s, Dollar General and Dollar Tree bucked a trend of retailers struggling to overcome inflationary pressures.", ,https://www.nytimes.com/2022/05/26/business/macys-dollar-general-dollar-tree-earnings.html
Business,2022-05-27 03:25:00,Daniel Defense Got $3.1 Million in Pandemic Aid,Daniel Defense was one of nearly 500 gun and ammunition makers and retailers that collected a total of $125 million from the Paycheck Protection Program., ,https://www.nytimes.com/2022/05/26/business/daniel-defense-ppp.html
Business,2022-05-27 03:30:00,Southwest and JetBlue Expect Higher Second-Quarter Revenues as Travel Booms,Ticket sales are climbing faster than the airline industry expected as more people plan summer vacations and business trips., ,https://www.nytimes.com/2022/05/26/business/southwest-jetblue-revenue.html
Most Viewed,2022-05-27 03:55:00,"1 in 5 Adult Covid Survivors in the U.S. May Develop Long Covid, Says CDC","Researchers identified lasting health problems in many different organ systems, including the heart, lungs and kidneys.", ,https://www.nytimes.com/2022/05/24/health/long-covid-infections.html
Science,2022-05-27 03:59:00,Who Is Protected Against Monkeypox?,"Older people who received smallpox vaccinations may yet have some immunity, researchers say. Healthy children and adults generally do not become severely ill.", ,https://www.nytimes.com/2022/05/26/health/monkeypox-vaccine-immunity.html
Technology,2022-05-27 07:00:00,"Accused of Cheating by an Algorithm, and a Professor She Had Never Met",An unsettling glimpse at the digitization of education., ,https://www.nytimes.com/2022/05/27/technology/college-students-cheating-software-honorlock.html
Climate,2022-05-27 07:00:00,How an Organized Republican Effort Punishes Companies for Climate Action,Legislators and their allies are running an aggressive campaign that uses public money and the law to pressure businesses they say are pushing “woke” causes., ,https://www.nytimes.com/2022/05/27/climate/republicans-blackrock-climate.html
Climate,2022-05-27 09:00:00,Why Are Bikes So Much Fun? Because They’re Not Cars.,"In “Two Wheels Good,” Jody Rosen makes clear that the bicycle has touched nearly every element of life on earth.", ,https://www.nytimes.com/2022/05/27/books/review/two-wheels-good-jody-rosen.html
Business,2022-05-27 11:04:00,"With VMware deal, Broadcom reaches for the cloud","The $61 billion combination is one of the biggest of the year, and may signal more tech deals to come.", ,https://www.nytimes.com/2022/05/26/business/dealbook/broadcom-wmware.html
Business,2022-05-27 12:53:00,What Dominated the World Economic Forum,"Our takeaways from Davos, plus how some influencers hype crypto without disclosing their financial ties.", ,https://www.nytimes.com/2022/05/27/business/dealbook/davos-world-economic-forum-crypto-promotions.html
Real Estate,2022-05-27 13:31:00,Housing Market Has Altered the Math of Moving,The housing market has altered the math of moving for nearly everyone., ,https://www.nytimes.com/2022/05/27/upshot/housing-market-slow-moving.html
Business,2022-05-27 13:33:00,"As Inflation Bites, Personal Income Stayed Strong","A government measure of disposable income rose 0.3 percent last month, but was flat when rising prices are taken into account.", ,https://www.nytimes.com/2022/05/27/business/inflation-personal-income.html
Most Emailed,2022-05-27 14:02:00,"Summer Movies 2022: ‘Jurassic World,’ ‘Thor’ and ‘Nope’","A Marvel god, a few new dinosaurs and a Jordan Peele enigma lead our list of the 101 most interesting movies headed your way this season.", ,https://www.nytimes.com/2022/05/27/movies/summer-movies-2022.html
Climate,2022-05-27 14:05:00,Gas Prices Hit New Highs as Summer Driving Season Starts,A gallon has jumped by about 50 cents over the last month as Russia’s war in Ukraine has continued to unsettle the global energy market., ,https://www.nytimes.com/2022/05/27/business/energy-environment/gas-prices-summer-driving.html
Real Estate,2022-05-27 14:19:00,An Opera Star Is Selling His Starter Home in the West Village,"Anthony Roth Costanzo, the countertenor — and real estate impresario — bought his one-bedroom co-op on Horatio Street nine years ago. He is asking $965,000.", ,https://www.nytimes.com/2022/05/27/realestate/anthony-roth-costanzo-home-sale.html
Business,2022-05-27 14:25:00,A Strong Summer Job Market for Teenagers,"Economists are predicting the highest rate of employment in 15 years. “Employers suddenly rediscovered teenagers,” one said.", ,https://www.nytimes.com/2022/05/27/your-money/summer-jobs-students.html
Homepage USA,2022-05-27 14:45:00,The True Cost of Kylian Mbappé’s New Deal,"It is easy to be dazzled by money in soccer, especially as the figures blur into incomprehension. But the numbers matter because of what comes next.", ,https://www.nytimes.com/2022/05/27/sports/soccer/kylian-mbappe-psg-contract.html
Economy,2022-05-27 14:51:00,Pakistan Raises Fuel Prices in Effort to Stabilize Economy,The interim government’s move was seen as a bid to revive a $6 billion bailout from the International Monetary Fund., ,https://www.nytimes.com/2022/05/27/world/asia/pakistan-fuel-price-crisis.html
Business,2022-05-27 15:31:00,Goldman’s Move to Unlimited Vacation Is Good for … Goldman,Goldman Sachs is the latest company to let workers take as much time off as they want. That means no more unused days — and no need to pay them out later., ,https://www.nytimes.com/2022/05/27/business/goldman-sachs-unlimited-vacation.html
USA,2022-05-27 15:40:00,Southern Baptists Release List of Alleged Sex Abusers,"The document’s existence, once kept secret, was revealed just days ago, sending shock waves through the denomination.", ,https://www.nytimes.com/2022/05/26/us/southern-baptist-sex-abusers.html
Technology,2022-05-27 16:04:00,Substack Drops Fund-Raising Efforts as Market Sours,"Amid an industrywide downturn, venture investors are preaching austerity and halting new deals, particularly for companies that have spent aggressively on growth.", ,https://www.nytimes.com/2022/05/26/business/media/substack-venture-capital.html
Climate,2022-05-27 16:12:00,"Hazel Henderson, Groundbreaking Environmentalist, Dies at 89","A self-taught apostle of the green economy and socially responsible investing, she taught her followers to act locally.", ,https://www.nytimes.com/2022/05/27/climate/hazel-henderson-dead.html
Technology,2022-05-27 16:53:00,Internet Drama in Canada. (Really.),"We all need great internet service, but it doesn’t happen by accident.", ,https://www.nytimes.com/2022/05/26/technology/canada-internet-service.html
Business,2022-05-27 17:19:00,Stock Market Set to Snap Long Losing Streak,"Investors this week put more money into stocks than they have in months, as markets regained some lost ground.", ,https://www.nytimes.com/2022/05/27/business/stocks-inflation-streak.html
Climate,2022-05-27 17:40:00,Children at risk,"At a meeting of global business leaders in Davos, Switzerland, the root cause of two crises, gun control and climate change, became clear: politics.", ,https://www.nytimes.com/2022/05/27/climate/davos-children-climate-change.html
Technology,2022-05-27 18:06:00,TikTok’s Amber Heard Hate Machine,Television turned the celebrity trial into a 24-hour tabloid spectacle. Social media made it into a sport., ,https://www.nytimes.com/2022/05/26/arts/amber-heard-tiktok-johnny-depp.html
Economy,2022-05-27 18:11:00,Americans Keep Spending Even as Inflation Erodes Buying Power,"To keep up with rising prices, Americans are saving less, but economists expect expenditures to slow in the months ahead.", ,https://www.nytimes.com/2022/05/27/business/economy/pce-inflation-april.html
Technology,2022-05-27 18:20:00,The S.E.C. Sent a Letter to Musk About His Twitter Shares in April,The regulator questioned whether the Tesla chief executive had disclosed his stake at the right time., ,https://www.nytimes.com/2022/05/27/technology/sec-elon-musk-twitter.html
Most Viewed,2022-05-27 18:29:00,The Joy Workout,Six research-backed moves to improve your mood, ,https://www.nytimes.com/2022/05/24/well/move/joy-workout-exercises-happiness.html
Most Viewed,2022-05-27 18:39:00,Students Called 911 Many Times While Texas Shooting Gunman Was In the Room,"Students who were in the classroom with the gunman called 911 several times, including a lengthy call during which some shooting and other sounds of the attack could be heard, according to Steven McCraw, director of the Texas Department of Public Safety.", ,https://www.nytimes.com/2022/05/27/us/texas-shooting-911-call-press-conference.html
Science,2022-05-27 19:04:00,Inside the ‘Top Gun: Maverick’ Flying Sequences,The makers of the “Top Gun” sequel discuss the challenges of filming practical aerial stunts., ,https://www.nytimes.com/2022/05/27/movies/top-gun-maverick-flying-scenes.html
Business,2022-05-27 20:02:00,"Is the Stock Market a Shy Bear, or Will It Become a Monster?","The decline has been unnerving, but readers want to know how nasty this year’s downturn may become. Our columnist turns to history for answers.", ,https://www.nytimes.com/2022/05/27/business/stock-market-bear-bull.html
Business,2022-05-27 20:11:00,Eric Adams Meets With NYC Business Leaders About Subway Safety,"In his quest to get more workers back to the city, the mayor tried to reassure employers that he was taking steps to address crime, especially on the subways.", ,https://www.nytimes.com/2022/05/27/business/eric-adams-rto-subway.html
Politics,2022-05-27 21:11:00,Why the Once-Hawkish Heritage Foundation Opposed Aid to Ukraine,"The conservative think tank has shifted on foreign policy along with the Republican grass-roots, and it is taking a more skeptical view of U.S. involvement in the world.", ,https://www.nytimes.com/2022/05/27/us/politics/ukraine-aid-heritage-foundation.html
Most Viewed,2022-05-27 21:17:00,Amanda Gorman Poem: Hymn for the Hurting,"A new poem from Amanda Gorman, written after the tragedy in Uvalde, Texas.", ,https://www.nytimes.com/2022/05/27/opinion/amanda-gorman-uvalde-poem.html
Politics,2022-05-27 22:41:00,Meet the Reclusive Software Billionaire Attacking Elon Musk,"Dan O’Dowd, a software entrepreneur in California, is running for Senate on a single-issue platform: Tesla’s self-driving software.", ,https://www.nytimes.com/2022/05/27/us/politics/california-senate-candidate-odowd-musk.html
Politics,2022-05-28 00:35:00,Prosecutors and Defense Duel in Closing Arguments of Sussmann Trial,A verdict is expected as early as Tuesday in the case brought by a Trump-era special counsel against a lawyer with ties to Hillary Clinton’s 2016 presidential campaign., ,https://www.nytimes.com/2022/05/27/us/politics/michael-sussmann-trial-durham.html
Politics,2022-05-28 01:19:00,"At N.R.A. Convention, the Blame Is on ‘Evil,’ Not Guns","Above all else, activists and politicians at the gathering sought to divert pressure to support popular overhauls like expanded background checks by seizing on the issue of school safety.", ,https://www.nytimes.com/2022/05/28/us/politics/nra-convention-guns.html
Politics,2022-05-28 01:19:00,Border Patrol Unit Has Played High-Profile Role Before Uvalde,One of the unit’s sharpshooters killed the gunman at Robb Elementary School; its members have Special Forces-type training and often target smuggling operations., ,https://www.nytimes.com/2022/05/28/us/politics/border-patrol-uvalde.html
Most Viewed,2022-05-28 02:28:00,Fact-Checking Trump and Cruz at the N.R.A. Convention,"The former president and the Texas senator made inaccurate or misleading claims about the efficacy of gun restrictions, gun ownership trends and school shootings.", ,https://www.nytimes.com/2022/05/27/us/politics/fact-check-trump-cruz-nra.html
Business,2022-05-28 03:21:00,Trump’s Lawsuit Against Letitia James Is Dismissed,"Mr. Trump had argued that an inquiry by the attorney general, Letitia James, violated his constitutional rights. It was his second legal loss in two days.", ,https://www.nytimes.com/2022/05/27/nyregion/trump-letitia-james-ny.html
Politics,2022-05-28 07:00:00,Trump’s Primary Losses Puncture His Invincibility,"With many of Donald J. Trump’s endorsed candidates falling to defeat in recent primaries, some Republicans see an opening for a post-Trump candidate in 2024.", ,https://www.nytimes.com/2022/05/28/us/politics/trump-endorsed-candidates-primary-elections.html
Real Estate,2022-05-28 09:00:00,My Roommate Won’t Pay Rent and Won’t Leave. What Can I Do?,"When housing courts become involved, there’s often little to do but wait. However, a private settlement is often the best way forward.", ,https://www.nytimes.com/2022/05/28/realestate/roommate-unpaid-rent-housing-court.html
World,2022-05-28 09:00:00,"The Fall of the ‘Sun King’ of French TV, and the Myth of Seduction","Patrick Poivre d’Arvor, known as a great seducer, has been accused by more than 20 women of rape, sexual assault and harassment in France’s belated #MeToo reckoning.", ,https://www.nytimes.com/2022/05/28/world/europe/france-metoo-patrick-poivre-darvor.html
Real Estate,2022-05-28 09:00:00,"How a 7,000-Ton Broadway Theater Was Hoisted 30 Feet","The Beaux-Arts interior of the Palace Theater is a protected landmark, so developers had to devise a plan to raise it three stories in their effort to add more retail space.", ,https://www.nytimes.com/2022/05/28/business/palace-theater-times-square-lift.html
Climate,2022-05-28 09:00:00,Heat Waves in New York Highlight Climate Inequality,"When heat waves hit, everyone suffers. But the pain will not be shared equally throughout New York City. Here, the neighborhoods where climate inequality will hurt the most.", ,https://www.nytimes.com/2022/05/28/nyregion/heat-waves-climate-change-inequality.html
World,2022-05-28 10:00:00,What Canada Doesn’t Know About Its Guns,"New record-keeping requirements for nonrestricted firearms began this month, but the origins of Canada’s so-called crime guns are largely unknown.", ,https://www.nytimes.com/2022/05/28/world/canada/gun-laws-canada.html
Most Emailed,2022-05-28 10:20:00,Ukrainian Orthodox Church Breaks With Moscow Over War,The Council of the Ukrainian Orthodox Church said that it disagreed with the Moscow Patriarch’s position on the war., ,https://www.nytimes.com/2022/05/28/world/europe/ukraine-orthodox-church-moscow.html
World,2022-05-28 10:39:00,Summer Reading,Today we look at this summer’s crop of new books., ,https://www.nytimes.com/2022/05/28/briefing/summer-reading-books-picks.html
Business,2022-05-28 13:08:00,Activist Investing Has Come for Fossil Fuels. What About Guns?,"With politicians unwilling to act, some investors are trying to use shareholder resolutions to get gun makers to rein in their products.", ,https://www.nytimes.com/2022/05/28/business/gun-companies-activist-shareholders.html
Politics,2022-05-28 14:16:00,Diplomats Fear Russia May Use Syrian Aid as Bargaining Chip in Ukraine,Countries in Europe and the Middle East could see a new surge in refugees if Russia shuts down the last humanitarian convoy route into Syria., ,https://www.nytimes.com/2022/05/28/us/politics/russia-syria-aid-refugees.html
